<?xml version="1.0" encoding="UTF-8"?>
<availabilities xmlns:xsi="http://www.w3.org/2001/XMLSchema-instance"
	xsi:noNamespaceSchemaLocation="validation/punkapocalyptic-model-unit-availability.xsd">
	<availability>
		<unit>chief</unit>
		<armor>hardened_leather</armor>
		<constraints>
			<min_weapons>1</min_weapons>
			<max_weapons>2</max_weapons>
		</constraints>
		<weapons>
			<weapon>automatic_rifle</weapon>
			<weapon>crossbow</weapon>
			<weapon>mace</weapon>
			<weapon>medium_blade</weapon>
			<weapon>pistol</weapon>
			<weapon>rifle</weapon>
			<weapon>shotgun</weapon>
		</weapons>
		<armors>
			<armor>
				<name>bulletproof_vest</name>
				<cost>10</cost>
			</armor>
			<armor>
				<name>metallic_armor</name>
				<cost>10</cost>
			</armor>
		</armors>
	</availability>
	<availability>
		<unit>badass</unit>
		<armor>thick_clothes</armor>
		<constraints>
			<min_weapons>1</min_weapons>
			<max_weapons>2</max_weapons>
		</constraints>
		<weapons>
			<weapon>automatic_rifle</weapon>
			<weapon>crossbow</weapon>
			<weapon>mace</weapon>
			<weapon>medium_blade</weapon>
			<weapon>pistol</weapon>
			<weapon>rifle</weapon>
			<weapon>shotgun</weapon>
		</weapons>
		<armors>
			<armor>
				<name>hardened_leather</name>
				<cost>5</cost>
			</armor>
			<armor>
				<name>metallic_armor</name>
				<cost>15</cost>
			</armor>
		</armors>
	</availability>
	<availability>
		<unit>brute</unit>
		<armor>hardened_leather</armor>
		<constraints>
			<min_weapons>1</min_weapons>
			<max_weapons>2</max_weapons>
		</constraints>
		<weapons>
			<weapon>heavy_blade</weapon>
			<weapon>heavy_mace</weapon>
			<weapon>mace</weapon>
			<weapon>shotgun</weapon>
		</weapons>
		<armors>
			<armor>
				<name>metallic_armor</name>
				<cost>10</cost>
			</armor>
			<armor>
				<name>metal_plate</name>
				<cost>15</cost>
			</armor>
		</armors>
		<equipment_pieces>
			<equipment_piece>shield</equipment_piece>
		</equipment_pieces>
	</availability>
	<availability>
		<unit>ganger</unit>
		<armor>thick_clothes</armor>
		<constraints>
			<min_weapons>1</min_weapons>
			<max_weapons>2</max_weapons>
		</constraints>
		<weapons>
			<weapon>bow</weapon>
			<weapon>crossbow</weapon>
			<weapon>light_mace</weapon>
			<weapon>medium_blade</weapon>
			<weapon>mace</weapon>
			<weapon>pistol</weapon>
			<weapon>rifle</weapon>
			<weapon>shotgun</weapon>
			<weapon>small_blade</weapon>
			<weapon>throwing_knife</weapon>
		</weapons>
		<armors>
			<armor>
				<name>hardened_leather</name>
				<cost>5</cost>
			</armor>
		</armors>
	</availability>
	<availability>
		<unit>scumbag</unit>
		<armor>thick_clothes</armor>
		<constraints>
			<min_weapons>1</min_weapons>
			<max_weapons>2</max_weapons>
		</constraints>
		<weapons>
			<weapon>bow</weapon>
			<weapon>light_mace</weapon>
			<weapon>pistol</weapon>
			<weapon>small_blade</weapon>
			<weapon>throwing_knife</weapon>
		</weapons>
	</availability>
</availabilities>